Pregunta,Correcta,Incorrecta1,Incorrecta2,Incorrecta3,Dato curioso de la pregunta
¿Cuál es la capital de Coahuila?,Saltillo,Torreón,Monclova,Piedras Negras,Saltillo es famosa por el sarape y por su arquitectura histórica.
¿Cuál es el nombre oficial completo del estado?,Coahuila de Zaragoza,Coahuila del Norte,Estado de Saltillo,Nueva Coahuila,El apellido Zaragoza honra al general Ignacio Zaragoza.
¿Con qué país limita Coahuila al norte?,Estados Unidos,Guatemala,Belice,Canadá,Su frontera norte conecta principalmente con el estado de Texas.
¿Con qué estado de Estados Unidos colinda Coahuila?,Texas,California,Arizona,Nuevo México,La frontera coahuilense con Texas se extiende a lo largo del Río Bravo.
¿Qué río marca parte de la frontera entre Coahuila y Estados Unidos?,Río Bravo,Río Nazas,Río Lerma,Río Balsas,En Estados Unidos se le conoce como Rio Grande.
¿Cuántos municipios tiene Coahuila?,38,32,43,58,Coahuila es uno de los estados mexicanos con menos municipios que otros estados grandes.
¿Qué desierto cubre gran parte del territorio coahuilense?,Desierto de Chihuahua,Desierto de Sonora,Desierto de Altar,Desierto de Vizcaíno,Es uno de los desiertos más grandes de Norteamérica.
¿Qué ciudad coahuilense forma parte importante de la Comarca Lagunera?,Torreón,Saltillo,Acuña,Múzquiz,Torreón comparte la región lagunera con municipios de Durango.
¿Qué ciudad de Coahuila es conocida por su industria acerera?,Monclova,Parras de la Fuente,Viesca,Candela,Monclova es apodada a menudo la capital del acero.
¿Qué región de Coahuila se asocia históricamente con la extracción de carbón?,Región Carbonífera,Región Huasteca,Región Maya,Región Mixteca,Municipios como Sabinas y Múzquiz forman parte de esta zona.
¿Qué producto artesanal es símbolo tradicional de Saltillo?,Sarape,Talavera,Alebrije,Sombrero jipi,El sarape de Saltillo es reconocido por sus colores y patrones.
"¿Qué museo de Saltillo se centra en desiertos, fósiles y biodiversidad?",Museo del Desierto,Museo Soumaya,Museo Nacional de Antropología,Museo del Templo Mayor,Es uno de los espacios culturales más visitados de la ciudad.
¿Qué museo de Saltillo está dedicado a las aves de México?,Museo de las Aves de México,Museo del Acero,Museo de la Ballena,Museo del Ferrocarril,Su colección representa una gran parte de las especies de aves mexicanas.
¿Qué Pueblo Mágico de Coahuila es famoso por sus pozas y humedales?,Cuatro Ciénegas,Arteaga,Guerrero,Nava,Sus pozas albergan especies únicas y estromatolitos.
¿Qué municipio coahuilense es famoso por su tradición vitivinícola?,Parras de la Fuente,Acuña,San Pedro,Frontera,Parras es un oasis agrícola dentro de una zona semidesértica.
¿Qué antigua casa vinícola se ubica en Parras de la Fuente?,Casa Madero,Casa Azul,Casa Barragán,Casa Carranza,Se le considera una de las vinícolas más antiguas del continente americano.
¿Qué sierra atraviesa zonas del sureste de Coahuila?,Sierra Madre Oriental,Sierra Madre del Sur,Sierra de Baja California,Sierra de los Tuxtlas,En Arteaga se aprecian paisajes montañosos de esta sierra.
¿En qué municipio se encuentra la zona paleontológica de Rincón Colorado?,General Cepeda,Piedras Negras,Matamoros,Allende,Rincón Colorado conserva fósiles del Cretácico tardío.
¿Qué dinosaurio descubierto en Coahuila lleva el nombre del estado?,Velafrons coahuilensis,Tyrannosaurus rex,Brachiosaurus altithorax,Stegosaurus stenops,Su nombre hace referencia a su cresta parecida a una vela.
¿Qué tipo de dinosaurios herbívoros se han encontrado en Rincón Colorado?,Hadrosaurios,Pterosaurios,Mosasaurios,Anquilosaurios,Los hadrosaurios también son llamados dinosaurios pico de pato.
¿Qué zona natural de Coahuila es conocida por tener estromatolitos?,Cuatro Ciénegas,La Huasteca,Isla Espíritu Santo,Nevado de Toluca,Los estromatolitos son estructuras formadas por microorganismos.
¿Qué formación natural destaca en las Dunas de Yeso de Coahuila?,Arena blanca de yeso,Lava volcánica negra,Hielo permanente,Coral marino vivo,Las dunas se ven muy claras por los cristales de yeso.
"¿Qué ciudad fronteriza de Coahuila está frente a Eagle Pass, Texas?",Piedras Negras,Torreón,Saltillo,Ramos Arizpe,La ciudad es conocida también por la historia de los nachos.
"¿Qué ciudad fronteriza de Coahuila está frente a Del Rio, Texas?",Ciudad Acuña,Monclova,Parras,Viesca,Acuña es uno de los cruces fronterizos importantes del estado.
¿Qué platillo popular se asocia con la ciudad de Piedras Negras?,Nachos,Mole poblano,Cochinita pibil,Tlayudas,Una versión muy conocida ubica su origen en Piedras Negras.
¿Qué Pueblo Mágico coahuilense es conocido por sus paisajes boscosos y de montaña?,Arteaga,Frontera,Nava,Matamoros,Arteaga suele asociarse con clima fresco y zonas serranas.
¿Qué Pueblo Mágico de Coahuila es conocido por las Dunas de Bilbao?,Viesca,Acuña,Ramos Arizpe,Morelos,Las dunas se usan mucho como atractivo natural y fotográfico.
¿Qué Pueblo Mágico de Coahuila se relaciona con aguas termales y paisajes de sierra?,Candela,Castaños,Juárez,Progreso,"Candela combina historia, naturaleza y turismo de aventura."
¿Qué Pueblo Mágico coahuilense se ubica en una zona con presencia de la comunidad kikapú?,Múzquiz,Saltillo,Torreón,Nadadores,Múzquiz destaca por su diversidad cultural y paleontológica.
¿Qué personaje histórico nació en Parras de la Fuente?,Francisco I. Madero,Benito Juárez,Miguel Hidalgo,Porfirio Díaz,Madero fue una figura central de la Revolución Mexicana.
¿Qué personaje histórico nació en Cuatro Ciénegas?,Venustiano Carranza,Emiliano Zapata,José María Morelos,Lázaro Cárdenas,Carranza fue presidente de México y líder constitucionalista.
¿Qué ciudad de Coahuila es sede del Cristo de las Noas?,Torreón,Saltillo,Monclova,Sabinas,El monumento se ubica en un cerro con vista panorámica de la ciudad.
¿Qué antigua obra subterránea se puede visitar en Torreón?,Canal de la Perla,Acueducto de Querétaro,Túnel de Ogarrio,Puente de Baluarte,El canal recuerda el origen agrícola y urbano de Torreón.
¿Qué equipo de futbol mexicano tiene su sede en Torreón?,Santos Laguna,Tigres UANL,Pachuca,Atlas,Su nombre hace referencia a la región de La Laguna.
¿Qué aeropuerto sirve principalmente a la zona de Saltillo y Ramos Arizpe?,Aeropuerto Internacional Plan de Guadalupe,Aeropuerto de Cancún,Aeropuerto de Toluca,Aeropuerto de Mérida,"Se ubica en Ramos Arizpe, cerca de Saltillo."
¿Qué municipio industrial está junto a Saltillo y forma parte de su zona metropolitana?,Ramos Arizpe,Viesca,Jiménez,Sierra Mojada,Ramos Arizpe destaca por su actividad automotriz e industrial.
¿Qué estado mexicano NO colinda con Coahuila?,Yucatán,Nuevo León,Durango,Chihuahua,"Coahuila se localiza en el norte de México, lejos de la península yucateca."
¿Qué estado mexicano colinda al este con Coahuila?,Nuevo León,Campeche,Colima,Morelos,La cercanía con Nuevo León fortalece la actividad industrial regional.
¿Qué estado mexicano colinda al oeste con Coahuila?,Chihuahua,Tabasco,Guerrero,Hidalgo,Ambos estados comparten zonas áridas del norte de México.
¿Qué estado mexicano colinda al sur con Coahuila?,Zacatecas,Quintana Roo,Tlaxcala,Nayarit,Coahuila también colinda al sur con San Luis Potosí y Durango.
¿Qué porcentaje aproximado del territorio nacional representa Coahuila?,7.7%,1.2%,15.4%,0.5%,"Por superficie, Coahuila está entre los estados más extensos del país."
¿Qué lugar ocupa Coahuila por extensión territorial entre los estados de México?,Tercer lugar,Primer lugar,Décimo lugar,Último lugar,Solo algunos estados del norte superan su enorme superficie.
¿Qué ciudad es la capital municipal y centro histórico más reconocido del sureste coahuilense?,Saltillo,Acuña,Sabinas,Ocampo,"Saltillo concentra edificios históricos, museos y vida administrativa."
¿Qué actividad económica es muy característica de Parras de la Fuente?,Producción de uva y vino,Pesca de camarón,Cultivo de cacao,Producción de henequén,El Valle de Parras se beneficia de manantiales y clima seco.
¿Qué atractivo de Saltillo muestra esqueletos y réplicas de dinosaurios?,Museo del Desierto,Museo Frida Kahlo,Museo del Virreinato,Museo de Cera,La paleontología es parte importante de la identidad turística de Coahuila.
¿Qué municipio coahuilense se relaciona con la ruta turística 'Vinos y Dinos'?,General Cepeda,Tulum,Tequila,Taxco,La ruta combina viñedos con zonas de valor paleontológico.
¿Qué tipo de clima predomina en gran parte de Coahuila?,Seco y semiseco,Tropical lluvioso,Polar,Selva húmeda,"La aridez explica la presencia de desiertos, matorrales y oasis."
¿Qué recurso natural dio nombre a la Región Carbonífera?,Carbón,Oro,Sal marina,Petróleo submarino,La minería del carbón ha sido clave para varios municipios de la región.
¿Qué municipio de Coahuila es conocido por el Museo del Desierto?,Saltillo,Viesca,Nava,Escobedo,El museo se ha convertido en referente del norte de México.
¿Qué municipio de Coahuila es famoso por las pozas de agua azul y la biodiversidad endémica?,Cuatro Ciénegas,Piedras Negras,Matamoros,Morelos,El valle es estudiado por científicos por su biodiversidad única.